{
  "assertion_version": "annotation_quality_filter_expected_assertions.v2.0",
  "test_id": "TC-017",
  "expected_status": "succeeded",
  "expected_error_code": null,
  "expected_codes": [
    "ENTITY_SPAN_INVALID",
    "ENTITY_TEXT_MISMATCH"
  ],
  "expected_absent_codes": [],
  "expected_cli_exit_code": 0,
  "expected_document_preserved": true,
  "fixture_mutation_summary": "Fixture docs/testing/fixtures/Q/TC-017/stanza_annotation.json is a full Stanza v2.0 JSON object with a minimal deterministic mutation for ENTITY_SPAN_INVALID, ENTITY_TEXT_MISMATCH.",
  "expected_score_rule": "Exact score, band, risk, warning/error counts and summary deltas are declared under expected_quality_assertions and MUST be checked without prose interpretation.",
  "expected_quality_assertions": [
    {
      "scope": "entity",
      "text_unit_id": "ch1:text",
      "sentence_id": null,
      "entity_id": "ch1:text:e2",
      "expected_issue_codes": [
        "ENTITY_SPAN_INVALID",
        "ENTITY_TEXT_MISMATCH"
      ],
      "expected_issue_entities": [
        {
          "code": "ENTITY_SPAN_INVALID",
          "entity_type": "entity",
          "entity_id": "ch1:text:e2",
          "field": "span",
          "path": null
        },
        {
          "code": "ENTITY_TEXT_MISMATCH",
          "entity_type": "entity",
          "entity_id": "ch1:text:e2",
          "field": "text",
          "path": null
        }
      ],
      "expected_score": 0.0,
      "expected_band": "invalid",
      "expected_risk_level": null,
      "expected_warning_count": 1,
      "expected_error_count": 1,
      "expected_summary_assertions": {
        "quality.summary.total_entities_evaluated": 2,
        "quality.summary.invalid_entities": 1,
        "quality.summary.high_quality_entities": 1,
        "quality.summary.warning_count": 1,
        "quality.summary.error_count": 1,
        "text_unit.summary.warning_count": 1,
        "text_unit.summary.error_count": 1
      },
      "notes": "Entity issue expectations are evaluated on entity_quality entry ch1:text:e2; sentence_quality for the same text unit remains valid/high unless separately mutated."
    }
  ],
  "required_assertions": [
    "result validates against the public output schema when a JSON result is produced",
    "issue appears at the exact declared scope and id",
    "issue entity_type/entity_id/field match expected_issue_entities",
    "score, band, risk_level, warning_count, error_count, and summary values equal expected_quality_assertions",
    "unexpected top-level error is absent for succeeded quality issue tests",
    "diagnostic and issue ordering follows the deterministic ordering contract"
  ]
}
